Block Lot,Address,Planning Neighborhood,Best Stat,Best Date,Units,Planning Project Description,DBI Project Description,Zoning_Generalized,Zoning_Simplified,TAZ,Total GSF (Commercial),Office,"Cult, Inst, Educ",Medical,"Prod, Dist, Rep","Ret, Ent",Visitor,Planning ID,DBI Permit,Planning Filed,DBI Filed,HEIGHTLIMIT,ZONING,FirstFiled,Longitude,Latitude,ObjectID,TempSelect,LANDUSE,EntitlementStatus,sort,ACTION_SEQ,Net Added Units,Net Added SF3534005,126 GUERRERO ST,Market Octavia,CONSTRUCTION,4/12/10,3,Vertical extension to the existing rear yard structure that would add a third dwelling unit to the property.  Convert all dwellings to condos.,TO EXPAND EXISTING REAR YARD ONE STORY DETACHED STRUCTURE. TO ADD ONE RESIDENTIAL UNIT VERTICALLY AB,Residential,RTO,232,0,,,,,,,2007.1422,2.00712E+11,,12/11/07,40-X,RTO,11-Dec-07,-122.424613,37.769031,1497,,Resident,-1,Construction,13,1,0822014,840 FELL ST,Western Addition,CONSTRUCTION,10/22/09,3,,Convert 4th floor into separate new 3rd unit by converting (e) pitch to (n)flat roof beyond 25' fron,Residential,RM-1,265,0,,,,,,,,2.00712E+11,,12/31/07,40-X,RM-1,31-Dec-07,-122.431732,37.774933,560,,Resident,-1,Construction,13,1,06272018,4847 MISSION ST,"South Central, Other",CONSTRUCTION,2/25/09,2,,Revision to PA# 2001/05/30/0305 to convert 2nd floor family rm. to kitchen and create a new unit. Re,Mixed Use,NC-3,39,0,,,,,,,,2.00801E+11,,1/11/08,40-X,NC-3,11-Jan-08,-122.437618,37.720738,2749,,Resident,-1,Construction,13,1,06943007,259 BRIGHTON AV,"Ingleside, Other",CONSTRUCTION,11/5/09,2,,1) THREE STORY REAR ADDITION (TOTAL AREA: 1908 SQ. FT.) 2) ADD ONE UNIT ON 3RD FLOOR.,Residential,RH-2,53,0,,,,,,,,2.00801E+11,,1/15/08,40-X,RH-2,15-Jan-08,-122.455274,37.722908,2968,,Resident,-1,Construction,13,1,04073039,2005 19TH ST,Showpl/Potrero,CONSTRUCTION,4/2/10,2,,"Multiple PermitsCONSTRUCTION OF A NEW THREE-STORY SINGLE FAMILY DWELLING - BUILDING ""2"". ; CONSTRUCTION OF A NEW THREE-STORY SINGLE FAMILY DWELLING - BUILDING ""1"".",Residential,RH-2,606,0,0,0,0,0,0,0,,2.00801E+11,,1/25/08,40-X,RH-2,25-Jan-08,-122.402702,37.76079,2118,,Resident,-1,Construction,13,1,0540017,2948 FILLMORE ST,Marina,CONSTRUCTION,4/8/10,3,"Existing 2-unit, 2,000 sqft, 30-foot in height residential building with 2 parking spaces. Proposed 3-unit, 4,500 sqft, 40-foot in height residnetial building with 6 parking spaces.",TO ERECT 3 DWELLING UNITS WITH 4 STORY NEW BLDG,Residential,RH-3,359,0,,,,,,,2008.0322,2.00807E+11,3/17/08,7/28/08,40-X,RH-3,17-Mar-08,-122.43522,37.796645,368,,Resident,-1,Construction,13,1,0242027,855 SACRAMENTO ST,Northeast,CONSTRUCTION,4/16/10,0,,"ADD A NEW 3-STORY BLDG WITH NATATORIUM AT GROUND LEVEL, HEALTH/FITNESS FACILITIES ON 2ND & 3RD FLOOR",Mixed Use,CRNC,783,"20,000",,"20,000",,,,,1999.536,2.00803E+11,,3/21/08,65-A,CRNC,21-Mar-08,-122.406938,37.79315,170,,CIE,-1,Construction,13,0,"20,000"2607270,455-457 BUENA VISTA EAST AV,Buena Vista,CONSTRUCTION,3/29/10,2,,ERECT A NEW FOUR STORY TWO FAMILY DWELLING BUILDING,Residential,RH-3,562,0,,,,,,,,2.00805E+11,,5/16/08,40-X,RH-3,16-May-08,-122.441393,37.766176,1250,,Resident,-1,Construction,13,2,01553019,924 BALBOA ST,Richmond,CONSTRUCTION,1/21/10,1,,"PRESENT USE: SCHOOL. REVERT BACK TO ORIGINAL USE-RESIDENTIAL. REPLACE WINDOWS, REMODEL BATHS & KITCH",Residential,RH-1(D),276,0,,0,,,,,,2.00807E+11,,7/7/08,40-X,RH-1(D),7-Jul-08,-122.468628,37.777142,959,,Resident,-1,Construction,13,1,"-3,650"792028,365 FULTON STREET,Market Octavia,CONSTRUCTION,4/19/10,120,Special needs,"ERECT 5 STORIES ,120 RESIDENTIAL UNITS & COMMERCIAL.",Mixed Use,NCT-3,619,0,0,0,0,0,0,0,,2.00807E+11,,7/11/08,65-X,NCT-3,11-Jul-08,-122.422738,37.778683,536,,Resident,-1,Construction,13,120,01101007,1301 DIVISADERO ST,Western Addition,CONSTRUCTION,6/8/09,12,,"DEMOLITION OF EXISTING GAS STATION.;TO ERECT 4 STORIES, 12 RESIDENTIAL CONDOMINIUMS.",Mixed Use,NC-2,670,0,,,,,,,,2.00807E+11,,7/24/08,65-A,NC-2,24-Jul-08,-122.439229,37.781605,722,,Resident,-1,Construction,13,12,"-13,264"1795020,1366 41ST AV,Outer Sunset,CONSTRUCTION,12/30/09,2,,"RAISE UPPER LEVEL OF HOUSE 4'-6"" TO CREATE NEW LEVEL 1 WITH 2 LEGAL PARKING SPACES AND NEW 2 BEDROOM",Residential,RH-2,207,0,,,,,,,,2.00808E+11,,8/21/08,40-X,RH-2,21-Aug-08,-122.500443,37.761344,1140,,Resident,-1,Construction,13,1,01198028,560 CENTRAL AV,Western Addition,CONSTRUCTION,11/17/09,2,,NEW VERTICAL ADDITION (NEW 3RD FLOOR) CREATING A NEW DWELLING UNIT,Residential,RH-3,256,0,,,,,,,,2.00808E+11,,8/27/08,40-X,RH-3,27-Aug-08,-122.444355,37.774715,751,,Resident,-1,Construction,13,1,05918030,413 BOWDOIN ST,"South Central, Other",CONSTRUCTION,1/13/10,1,,CONSTRUCTION OF 3-STORY SINGLE FAMILY DWELLING WITH GARAGE,Residential,RH-2,70,0,,,,,0,,,2.00808E+11,,8/28/08,40-X,RH-2,28-Aug-08,-122.412106,37.730141,2505,,Resident,-1,Construction,13,1,"-4,850"5918031,1208 SILVER AV,"South Central, Other",CONSTRUCTION,1/13/10,2,,CONSTRUCTION OF 3-STORY TWO FAMILY DEWLLING WITH GARAGE.,Residential,RH-2,70,0,,,,,0,,,2.00808E+11,,8/28/08,40-X,RH-2,28-Aug-08,-122.412034,37.730233,2506,,Resident,-1,Construction,13,2,"-4,850"5534038,347 MULLEN AV,Bernal Heights,CONSTRUCTION,4/16/10,1,,ERECT A NEW 3 STORIES SINGLE FAMILY DWELLING UNIT.,Residential,RH-1,126,0,,,,,,,,2.00809E+11,,9/9/08,40-X,RH-1,9-Sep-08,-122.405771,37.746149,2489,,Resident,-1,Construction,13,1,01460015,420 29TH AV,Richmond,CONSTRUCTION,4/21/10,20,,CONSTRUCTION OF THREE STORIES WITH BASEMENT 20  AFFORDABLE HOUSING UNITS.,Residential,RH-2,660,0,,0,,,,,,2.00809E+11,,9/19/08,40-X,RH-2,19-Sep-08,-122.488937,37.781324,889,,Resident,-1,Construction,13,20,"-6,720"2094005,3223 ORTEGA ST,Outer Sunset,CONSTRUCTION,4/20/10,0,"Demolish most of the existing library, move the site closer to Ortega Street, and build a new approximately 8,500 sq.ft. single story library in a P zone with an OS land designation.",CONSTRUCTION OF A NEW ONE STORY WOOD FRAME NON-RATED BRANCH LIBRARY.,Public,P,496,"8,500",,"8,500",,,,,2008.0434,2.0081E+11,,10/24/08,OS/40-X,P,24-Oct-08,-122.49805,37.751287,1221,,CIE,-1,Construction,13,0,"8,500"2802008,690 DOUGLASS ST,Central,CONSTRUCTION,11/13/09,3,Rear yard and dwelling unit exposure variances to construct a new single-family house at the rear of the subject property to act as a replacement dwelling unit for the dwelling unit that was removed without a permit from the existing building.  ,ERECT A SINGLE FAMILY UNIT IN REAR YARD,Residential,RH-2,159,0,,,,,,,2008.0854,2.0081E+11,,10/31/08,40-X,RH-2,31-Oct-08,-122.438808,37.752812,1062,,Resident,-1,Construction,13,1,0155052,5 CYRUS PL,Northeast,CONSTRUCTION,4/7/10,2,,REMODEL & ADDITION-HORIZONTAL ADDITION AT REAR. VERTICAL ADDITION OF ONE STORY ABOVE (E) ROOF. EXPAN,Residential,RH-3,351,0,,,,,,,,2.00811E+11,,11/10/08,65-A,RH-3,10-Nov-08,-122.417191,37.796369,152,,Resident,-1,Construction,13,1,06252036,201 LELAND AV,VisVal,CONSTRUCTION,12/14/09,0,City Acquisition of land for the future construction of the Visitacion Valley Branch Library,ERECT ONE STORY TYPE 5 PUBLIC LIBRARY.,Mixed Use,NC-2,18,"10,000",,"10,000",,,,,2003.0158,2.00812E+11,,12/23/08,40-X,RH-1/NC-2,23-Dec-08,-122.40754,37.712528,2745,,CIE,-1,Construction,13,0,"-4,830"3775095,425 BRYANT ST,East SoMa,CONSTRUCTION,3/10/10,1,CHANGE OF USE FROM STUDIO/FILM LAB (PDR) TO RESIDENTIAL USE AND ADDITION OF PARTIAL SECOND AND THIRD LEVELS.,CHANGE USE FROM ARTIST STUDIO TO SINGLE FAMILY RESIDENCE. HORIZONTAL ADDITION OF SECOND FLOOR. FULL ,Mixed Use,MUO,693,0,,,,,,,2007.1122,2.00901E+11,,1/14/09,45-X,MUO,14-Jan-09,-122.394031,37.782572,3217,2,Resident,-1,Construction,13,1,"-2,500"1567008,663 24TH AV,Richmond,CONSTRUCTION,3/30/10,2,,HORIZONTAL REAR ADDITION.,Residential,RH-2,274,0,,,,,,,,2.00901E+11,,1/14/09,40-X,RH-2,14-Jan-09,-122.483598,37.777078,3204,,Resident,-1,Construction,13,1,03752054,170 CLARA ST,East SoMa,CONSTRUCTION,2/16/10,1,"Change of use to residential, interior remodel and replace deck.","LEVEL 1: NO WORK. LEVEL 2: ADD KITCHEN, NEW BEDROOM CLOSET. LEVEL 3:ADD BEDROOM, BATH, EXTERIOR DECK",Mixed Use,MUR,664,0,,,,,,,2008.0662,2.00902E+11,,2/2/09,45-X,MUR,2-Feb-09,-122.401752,37.780133,3212,2,Resident,-1,Construction,13,1,"-3,080"1451032,354 20TH AV,Richmond,CONSTRUCTION,3/4/10,2,Add a second unit to an existing single family residence by constructing horizontal and vertical additions.,"HORIZONTAL & VERTICAL ADDITION TO BUILDING, FROM TWO STORIES TO FOUR STORIES, AND SINGLE FAMILY TO T",Residential,RM-1,677,0,,,,,,,2009.0711,2.00903E+11,7/28/09,3/2/09,40-X,RM-1,2-Mar-09,-122.479279,37.781248,3203,,Resident,-1,Construction,13,1,0947024,2760 BAKER ST,Marina,CONSTRUCTION,3/3/10,2,,"CHANGE OF USE: OFFICE/DWELLING UNIT TO DWELLING UNITS AT GROUND FLOOR INCLUDING ADD KITCHEN, SHOWER,",Residential,RH-2,356,0,,,,,,,,2.00905E+11,,5/29/09,40-X,RH-2,29-May-09,-122.445353,37.796393,10,,Resident,-1,Construction,13,1,01029095,2901 CALIFORNIA ST,Western Addition,CONSTRUCTION,4/26/10,0,"Appeal of Case # 2007.0128C, to demolish 3-residential units and construct new assembly space for the Drew School.","ADDITION OF APPROXIMATELY 14,800 ASSEMBLY HALL AND THEATRE AND CLASSMROOM TO THE EXISTING 26,500 HIG",Residential,RM-1,714,"41,307",,"41,307",,,,,2009.0549,2.00907E+11,,7/2/09,40-X,RM-1,2-Jul-09,-122.44236,37.787513,3230,,CIE,-1,Construction,13,0,"14,800"1672024,850 30TH AV,Richmond,CONSTRUCTION,2/24/10,2,,"CONVERT FAMILY ROOM TO KITCHEN, INSTALL CABINETS ON 1ST FLOOR, CONVERT 1 FAMILY DWELLING INTO 2 FAMI",Residential,RH-2,250,0,,,,,,,,2.0091E+11,,10/26/09,40-X,RH-2,26-Oct-09,-122.489282,37.773244,3281,,Resident,-1,Construction,13,1,0258033,500 PINE ST,Downtown,PL APPROVED,3/15/01,0,"On a vacant 13,800-sq.-ft. site, construction of a five-story, 61-ft. high office building w/ 11,220 sq. ft. of ground floor retail, 45,610 sq. ft. of office space and one subsurface level of parking w/ 39 spaces, and under the basement parking level woul",,Commercial,C-3-O,785,"56,830","45,610",0,0,0,"11,220",0,2000.539,,11/29/00,,300-S,C-3-O,29-Nov-00,-122.404641,37.791701,179,2,MIPS,-1,PL Approved,3,,"56,830"3746001,201 Folsom St,TB Combo,PL APPROVED,11/18/03,806,"Residential & Retail uses, and parking. Remove an existing US Postal Service surface parking lot and construct a new 38-40 story building with 806 residential units, ground floor retail, 806 off-street parking spaces for the residential use, 16 retail par",,Mixed Use,RC-4,765,0,0,0,0,0,0,0,2000.1073,,7/11/02,,85/150-R/ 85/,RC-4/DTR,11-Jul-02,-122.391876,37.789267,1808,2,Resident,-1,PL Approved,9,806,03702053,1169 MARKET ST,Downtown,PL APPROVED,8/3/06,970,"The proposed project is to demolish the existing 263,602gsf, 377 unit apartment complex and construction of a 1,500,000gsf three connected residential buildings over a 2-story podium, containing about 1,410 dwelling units, 20,000gsf of ground-floor retail",,Commercial,C-3-G,621,"40,000",0,0,0,0,"40,000",0,2002.1179,,7/15/03,,150-S,C-3-G,15-Jul-03,-122.414016,37.779181,1366,,Mixres,-1,PL Approved,5,593,"33,540"7331003,800 Brotherhood Way,Park Merced,PL Approved,12/10/07,127,"The project site is currently an 8.15-acre parcel of vacant land.  The proposed project involves the subdivision of the site into 127 lots and the construction of 127 buildings, including 66 single-family homes, 39 two-unit buildings, and 22 three-unit bu",,Residential,RM-1,884,0,0,0,0,0,0,0,2003.0536,,7/23/03,,40-X,RM-1,23-Jul-03,-122.47841,37.714747,3095,,Resident,-1,PL Approved,5,127,03732074,251 06TH ST,East SoMa,PL Approved,7/13/09,83,"Demolition of an existing one-story  building and construction of of a four-story SRO residential building with 83 SRO units, 1,450 GSF of ground floor retail use, and four off-street parking spaces.  ",,Mixed Use,NCT,628,"1,450",0,0,0,0,"1,450",0,2004.0999,,9/29/04,,45-X/85-X,SoMa NCT,29-Sep-04,-122.406201,37.779193,1878,,Mixres,-1,PL Approved,4,83,"1,450"3704069,973 MARKET ST,Downtown,PL APPROVED,8/14/08,100,69 new construction/mixed use (67 RES. AND 2 COMM.),,Commercial,C-3-G,667,"5,700",0,0,0,0,"5,700",0,2007.0368,,11/17/04,,120-X,C-3-G,17-Nov-04,-122.409745,37.782644,1735,,Mixres,-1,PL Approved,9,100,"-52,750"5880002,2350 SAN BRUNO AV,"South Central, Other",PL Approved,6/2/08,2,REAR YARD VARIANCE FOR NEW CONSTRUCTION OF A 2-UNIT BLDG.,DEMOLISH A 1 STORY HARDWARE RETAIL STORE,Residential,RM-1,92,0,0,0,0,0,0,0,2006.1205,2.00412E+11,9/28/06,12/1/04,40-X,RM-1,1-Dec-04,-122.406229,37.733184,2612,,Resident,-1,PL Approved,4,2,"-2,250"3765015,425 First Street,Rincon Hill,PL APPROVED,8/16/05,340,"The proposed project involves the demolition of the existing 75,816gsf Bank of America Clock Tower office building and the construction of a 534,500 gsf residential complex including 710 dwelling units and 246 off-street parking spaces.","TO ERECT 63 STORIES, 382 DWELLING UNITS, 2 LEVEL BASEMENTS OF B1 & B1, RESIDENTIAL CONDO.",High Density Residential,RH DTR,981,0,0,0,0,0,0,0,2003.0029,,5/6/05,12/21/04,45/550-R,DTR,21-Dec-04,-122.392803,37.7861,1975,2,Resident,-1,PL Approved,13,340,"-75,816"3728069,121 09TH ST,WSoMa,PL Approved,7/31/09,20,"Demolition of an existing commercial building and construction of a five-story mixed use building with 20 dwelling units, 17 off-street parking spaces, and appx. 800 GSF of ground floor commercial use, requiring variance for off-street parking.",,Industrial,SLR,622,800,0,0,0,0,800,0,2005.02,,3/31/05,,65-X,SLR,31-Mar-05,-122.41419,37.775958,1846,,Mixres,-1,PL Approved,5,20,"-4,975"1410017,2200 CLEMENT ST,Richmond,PL Approved,1/5/07,0,Demolish theater (Four Star) and constuct a new 3-story church (CU). Variance for exceptions to rear yard requirement and FAR.,,Mixed Use,NCD,676,"8,520",0,"8,520",0,0,0,0,2005.0602,,6/21/05,,40-X,OUTER CLEMENT,21-Jun-05,-122.482849,37.782179,841,,CIE,-1,PL Approved,4,0,"4,880"1149011,350 MASONIC AV,Western Addition,PL Approved,8/8/08,0,"Demolition of an existing single-family home and construction of an educational building (SF Day School) that would be three stories over a basement and measuring appx. 69,308 GSF.  The proposed project would include an underground garage with 20 off-stre",,Residential,RH-3,663,"69,308",0,"69,308",0,0,0,0,2005.0156,,9/13/05,,40-X,RH-3,13-Sep-05,-122.446775,37.778165,732,,CIE,-1,PL Approved,4,-1,"69,308"3753081,345 06TH ST,East SoMa,PL Approved,4/2/09,33,"Demolition of 2,973-sf one-story office and surface parking and new construction of 37,200-sf 37-unit five-story structure with residential over ground floor retail and 9-space parking.",,Mixed Use,MUR,631,"3,300",0,0,0,0,"3,300",0,2005.0876,,9/15/05,,85-X,MUR,15-Sep-05,-122.404729,37.777996,1942,,Mixres,-1,PL Approved,5,33,3243776149,424 BRANNAN ST,East SoMa,PL Approved,9/16/08,55,"New construction of mixed-use building with 78-units, 1 & 2 bdrm & townhome units, 2,657 groundfloor commercial, & 70 garage parking spaces, and rezone to allow 65-ft height limit.  To replace surface parking lot.",,Industrial,SLI,641,0,0,0,0,0,0,0,2005.1206,,12/22/05,,50-X,SLI,22-Dec-05,-122.395185,37.779613,1994,2,Resident,-1,PL Approved,4,55,03785003,690 05TH ST,WSoMa,PL Approved,6/17/09,0,"Proposed project would demolish the existing office building and its associated parking and construct a new 75 room hotel and 5,000 cafe/bar. The building would be approximately 65 feet in height , 46,000 sq. ft. and would include 27 below-grade parking s",,Mixed Use,SSO,925,"46,000",0,0,0,0,"5,000","41,000",2006.0091,,1/24/06,,65-X,SSO,24-Jan-06,-122.397874,37.775671,2009,2,Visitor,-1,PL Approved,3,0,"32,500"3747320,399 FREMONT ST,Rincon Hill,PL Approved,8/4/06,432,"The proposal is to demolish the existing structure and construct a new structure that would include a 400-foot tower, 450 dwelling units, and 450 off-street parking spaces.",ERECT 41 STORIES 432 DWELLING RESIDENTIAL/PARKING BLDG.,High Density Residential,RH DTR,767,"33,000","24,500",0,0,0,"8,500",0,2006.0358,2.00605E+11,4/18/06,5/16/06,85/400-R,RH DTR,18-Apr-06,-122.392065,37.786827,1809,2,Mixres,-1,PL Approved,2,432,"-2,256"3994001B,2065 03RD ST,Central Waterfront,PL Approved,3/26/09,62,"The proposed project would demolish the existing three one-story structures and construct 62 dwelling units, 7,000 sq. ft. of retail, and 62 parking spaces. The new project would be 65 feet in height and approximately 82,000 gsf. ",,Mixed Use,UMU,558,"7,000",0,0,0,0,"7,000",0,2006.0731,,6/7/06,,68-X,UMU,7-Jun-06,-122.388535,37.763492,2076,,Mixres,-1,PL Approved,4,62,"-4,725"1073013,800 PRESIDIO AV,Richmond,PL Approved,1/25/08,83,"The proposed project would demolish the existing one-story community center and construct a new building consisting of 83 dwelling units (59 units of work-force housing and 21 units of affordable housing.), 21,500 sq. ft. community center on the ground fl",,Residential,RM-1,311,"21,500",0,"21,500",0,0,0,0,2006.0868,,7/20/06,,40-X,RM-1,20-Jul-06,-122.446112,37.784362,705,,Mixres,-1,PL Approved,5,83,"10,180"1460040,420 29TH AV,Richmond,PL Approved,12/18/08,21,"The proposed project would demolish the existing church and its associated buildings and construct two buildings, a new 4,865 sq. ft. church and 21 residential units. Both buildings would be 40 feet in height. (1) CU application to demolish existing stru",,Residential,RH-2,660,"5,000",0,0,0,0,"5,000",0,2006.0881,,7/25/06,,40-X,RH-2,25-Jul-06,-122.488937,37.781324,888,,Mixres,-1,PL Approved,5,20,"-2,500"6250028,95 LELAND AV,VisVal,PL Approved,3/13/09,8,Demolition of an existing two-story two-unit building and one-story building at the rear of the lot. New construction of a four-story over basement building with eight units over eight parking spaces.,,Mixed Use,NC-2,15,0,0,0,0,0,0,0,2006.1082,,8/29/06,,40-X,NC-2,29-Aug-06,-122.405558,37.711792,2740,,Resident,-1,PL Approved,5,6,0813007,1390 MARKET ST,Market Octavia,PL Approved,5/28/09,230,"Fox Plaza currently contains two buildings: a 29-story mixed-use building and a two-story commercial building.  The proposal would demolish the existing two-story, 19,000 structure located on the NE corner of the lot and construct a new building which wou",,Commercial,C-3-G,647,"17,500",0,0,0,0,"17,500",0,2005.0979,,8/30/06,,120-X/200-S,C-3-G,30-Aug-06,-122.417444,37.776791,547,,Mixres,-1,PL Approved,5,230,"-1,500"4010006,575 VERMONT ST,Showpl/Potrero,PL Approved,2/11/08,2,Construct a second dwelling unit?,,Residential,RH-2,543,0,0,0,0,0,0,0,2006.107,,8/31/06,,40-X,RH-2,31-Aug-06,-122.404115,37.762514,2088,,Resident,-1,PL Approved,5,1,03511055,1029 NATOMA ST,WSoMa,PL Approved,6/11/09,4,"The proposal is to demolish a single-family fire-damaged structure, origianlly constructed in 1922, and to construct a new 4-unit residential structure in five stories.",,Industrial,SLR,591,0,0,0,0,0,0,0,2006.108,,9/7/06,,50-X,SLR,7-Sep-06,-122.416344,37.773114,1351,,Resident,-1,PL Approved,3,3,05577011,191 BREWSTER ST,Bernal Heights,PL Approved,10/28/09,1,"New 2,811 sqft single-family residence on vacant lot.","TO ERECT 4 STORIES, SINGLE FAMILY RESIDENCE.",Residential,RH-1,465,0,,,,,,,2009.1018,2.00609E+11,10/28/09,9/25/06,40-X,RH-1,25-Sep-06,-122.407638,37.743185,2495,,Resident,-1,PL Approved,6,1,06473038,5735-5743 MISSION ST,"South Central, Other",PL Approved,6/12/08,22,"The proposal project would demolish the three existing buildings on the site and construct a new four story building consisting of 22 residential units, 3,038 sq. ft. of retail, 1,788 sq. ft. of office and 35 parking spaces. The building would be approxim",,Mixed Use,NC-2,873,"4,826","1,788",0,0,0,"3,038",0,2006.1227,,10/19/06,,40-X,NC-2,19-Oct-06,-122.448989,37.709939,2786,,Mixres,-1,PL Approved,5,16,"-7,153"279011,1080 SUTTER ST,Downtown,PL Approved,5/28/09,35,"The project site is current vacant and used as a 20-space parking lot. The proposed project would construct 35 dwelling units and 1,339 sq. ft. of ground floor commercial space, and 13 parking spaces. The new structure would be approximately 51,950 sq. ft",,Mixed Use,RC-4,322,"1,339",0,0,0,0,"1,339",0,2006.0431,,10/25/06,,130-E,RC-4,25-Oct-06,-122.418078,37.788156,195,,Mixres,-1,PL Approved,5,35,"1,339"857001,55 Laguna Street,Market Octavia,PL Approved,1/17/08,491,"Mixed-use project which would include construction of seven new buildings and the adaptive re-use of two existing buildings for 491 dwelling units, 421 off-street parking spaces, 3,500 GSF of retail use, 12,000 GSF for a dental clinic, and 12,590 GSF for ",,Public,P,243,"3,500",0,0,0,0,"3,500",0,2004.0773,,10/31/06,,40-X,P,31-Oct-06,-122.425394,37.771351,584,,Mixres,-1,PL Approved,5,491,"28,090"287013,300 Grant Ave.,Downtown,PL Approved,7/10/08,66,"Demolition of 272 and 292 Sutter Street, 35,600-gsf retail, and new construction of 12-story, 113,526-gsf residential mixed-use structure in K-M-M-S Conservation District with 66 residential units, ground floor retail, and 25 underground parking spaces. """,,Commercial,C-3-R,932,"6,000",0,0,0,0,"6,000",0,2004.1245,,11/2/06,,80-130-F,C-3-R,2-Nov-06,-122.405341,37.789703,209,2,Mixres,-1,PL Approved,5,66,"-1,250"1671008M,850 29TH AV,Richmond,PL Approved,7/10/08,2,New Construction,,Residential,RH-2,251,0,0,0,0,0,0,0,2006.147,,12/6/06,,40-X,RH-2,6-Dec-06,-122.488368,37.773303,1063,,Resident,-1,PL Approved,5,1,06202046,169 DELTA ST,"South Central, Other",PL Approved,2/21/08,1,Proposing construction of a single-family dwelling unit on a vacant lot in a RH-1 (40-X) Height and Bulk District.,"TO ERECT A NEW 3 STORY, 1 DWELLING RESIDENTIAL UNIT",Residential,RH-1,23,0,,,,,,,2007.1373,2.00612E+11,11/16/07,12/20/06,40-X,RH-1,20-Dec-06,-122.407462,37.717372,2722,,Resident,-1,PL Approved,5,1,0347016,399 GOLDEN GATE AV,Downtown,PL Approved,11/27/07,0,"The proposal is the construction of a new Shih Yu-Lang Central YMCA Community Facility on land owne by the Hastings College of Law.  The new facility would include approcimately 53,000 gsf in four stories above a full basement at a height of about 76 feet",,Mixed Use,RC-4,286,"53,000",0,0,0,0,"53,000",0,2006.1532,,12/28/06,,80-T,RC-4,28-Dec-06,-122.416948,37.78135,291,,Retail/Ent,-1,PL Approved,5,0,"53,000"1028003,2829 California Street,Western Addition,PL Approved,1/17/08,12,"The proposed project would demolish the existing two-story building on the site and construct a four-story consisting of 12 residential units, 4,924 sq. ft. of retail, 2,281 sq. ft. of office, and 18 parking spaces. The building would be approximately 40 ",,Mixed Use,NC-2,714,"7,205","2,281",0,0,0,"4,924",0,2006.1525,,1/30/07,,40-X,NC-2,30-Jan-07,-122.44096,37.787871,678,,Mixres,-1,PL Approved,5,12,3731029003,2901 California St,Western Addition,PL Approved,6/16/09,0,"The proposed project would demolish the existing 40-foot tall 5,225 sf, three-unit residential building and construct a new three-story assembly and classroom wing consisting of 15,604 sf to the existing adjacent Drew School campus. The new building would",,Residential,RM-1,714,"42,074",0,"42,074",0,0,0,0,2007.0128,,2/2/07,,40-X,RM-1,2-Feb-07,-122.442235,37.787712,683,,CIE,-1,PL Approved,5,-3,"15,604"4624009,227 West Point Road,Other S Bayshore,PL Approved,12/10/08,668,"The proposed project would demolish the 267 affordable housing units in 50 buildings and construct about 668 affordable units, 6,400 sq. ft. of retail, 739 parking spaces in 66 buildings. Buildings would range from two to five-stories 20 to 50 feet in hei",,Residential,RM-1,446,"7,020",0,620,0,0,"6,400",0,2007.0168,,2/14/07,,40-X/65-X,RM-1,14-Feb-07,-122.379131,37.73508,2247,,Mixres,-1,PL Approved,5,401,6200133006A,1131 MONTGOMERY ST,Northeast,PL Approved,9/26/08,2,"The proposal is construction of a new three-story single-family house behind an existing one-story single family 850-square-foot house at 1131 Montgomery Street.  THe original foundation of the existing house would be replaced, restructured, excavated and",,Residential,RH-3,372,0,0,0,0,0,0,0,2007.0201,,2/23/07,,40-X,RH-3,23-Feb-07,-122.40427,37.799467,134,,Resident,-1,PL Approved,5,1,06322008H,2245 GENEVA AVENUE,"South Central, Other",PL Approved,10/2/08,9,CONSTRUCT THREE-STORY BUILDING ON EACH LOT WITH NINE DWELLING UNITS ABOVE PROPOSED GROUND FLOOR COMMERCIAL. NO PARKING.,,Mixed Use,NC-1,5,0,0,0,0,0,0,0,2006.0864,,3/29/07,,40-X,NC-1,29-Mar-07,-122.419246,37.708167,2760,,Resident,-1,PL Approved,5,9,06508034,3945 24TH ST,Central,PL Approved,10/22/07,4,"three story mixed use building CU for lot size, use size, 161j parking, second floor use (to be determined)",,Mixed Use,NCD,138,"6,000",,,,,"6,000",,2007.0435,,5/3/07,,40-X,24TH-NOE,3-May-07,-122.430646,37.751371,2800,,Mixres,-1,PL Approved,3,4,"6,000"808036,401 Grove Street,Market Octavia,PL Approved,11/20/08,70,"Proposed 70-unit residential project on ROW of old Freeway, Market-Octavia Plan Area, bounded by Gough, Grove, Ivy, in three buildings  with ground floor retail on the Gough frontage, 5-stories, 77,000-gsf, including 50 space subsurface parking. ",,Mixed Use,NCT,619,"7,000",,,,,"7,000",,2007.0487,,5/23/07,,40-X/50-X,HAYES NCT,23-May-07,-122.423316,37.777677,545,,Mixres,-1,PL Approved,5,70,"7,000"872005,1960-1998 MARKET ST,Market Octavia,PL Approved,6/4/09,115,"Demolition/removal of gas station.  Construction of 115 condominium units (130,000 square feet), 9,000 square feet of retail, 109 parking spaces.  The building would be approximately 85 feet tall and eight stories in height.1/11/07 Demolition/removal of ",,Mixed Use,NCT-3,243,"9,000",,,,,"9,000",,2006.1431,,5/29/07,,85-X,NCT-3,29-May-07,-122.425974,37.770026,594,,Mixres,-1,PL Approved,5,115,"9,000"4154001,1001 POTRERO AV,Showpl/Potrero,PL Approved,12/2/08,0,"Rebuild of SF General Hospital (SFGH) to new requirements, part of IMP: new 419,070-sf acute acre hospital building, 105-ft in height, and reuse of 129,706-sf Building 5, equivalent to existing hospital use capacity, with no proposed parking.",,Public,P,189,"548,776",,"548,776",,,,,2007.0603,,6/20/07,,105-E,P,20-Jun-07,-122.406606,37.756762,1821,,CIE,-1,PL Approved,5,0,"419,070"